{
  "artifacts": {
    "compatibility_report": "/Users/zacharywright/Documents/GitHub/hermes_dev/hermes-flight-recorder/experiments/qwen3_4b_flightrecorder/serving/local_adapter_mock_suite/trace_only/compatibility_report.json",
    "eval_stderr": null,
    "eval_stdout": null,
    "lifecycle_run": "/Users/zacharywright/Documents/GitHub/hermes_dev/hermes-flight-recorder/experiments/qwen3_4b_flightrecorder/serving/local_adapter_mock_suite/trace_only/serving_lifecycle_run.json",
    "server_stderr": "/Users/zacharywright/Documents/GitHub/hermes_dev/hermes-flight-recorder/experiments/qwen3_4b_flightrecorder/serving/local_adapter_mock_suite/trace_only/server_stderr.txt",
    "server_stdout": "/Users/zacharywright/Documents/GitHub/hermes_dev/hermes-flight-recorder/experiments/qwen3_4b_flightrecorder/serving/local_adapter_mock_suite/trace_only/server_stdout.txt",
    "serving_check": "/Users/zacharywright/Documents/GitHub/hermes_dev/hermes-flight-recorder/experiments/qwen3_4b_flightrecorder/serving/local_adapter_mock_suite/trace_only/serving_check.json",
    "serving_profile": "/Users/zacharywright/Documents/GitHub/hermes_dev/hermes-flight-recorder/experiments/qwen3_4b_flightrecorder/serving/local_adapter_mock_suite/trace_only/serving_profile.json"
  },
  "cleanup": {
    "attempted": true,
    "exit_code_after_cleanup": -15,
    "exit_code_before_cleanup": null,
    "killed": false,
    "process_group_id": 40578,
    "terminated": true,
    "terminated_signal_sent": true
  },
  "completed_at": "2026-07-02T14:14:03Z",
  "eval": {
    "reason": "no_eval_command",
    "status": "skipped"
  },
  "generated_at": "2026-07-02T14:14:03Z",
  "passed": true,
  "preflight": {
    "attempt_count": 2,
    "attempts": [
      {
        "at": "2026-07-02T14:14:03Z",
        "failed_checks": [
          "health",
          "models",
          "model_metadata",
          "chat_completion",
          "tool_call_required",
          "structured_output_required"
        ],
        "ready": false
      },
      {
        "at": "2026-07-02T14:14:03Z",
        "failed_checks": [],
        "ready": true
      }
    ],
    "compatibility_report": "/Users/zacharywright/Documents/GitHub/hermes_dev/hermes-flight-recorder/experiments/qwen3_4b_flightrecorder/serving/local_adapter_mock_suite/trace_only/compatibility_report.json",
    "failed_checks": [],
    "passed": true,
    "readiness": "ready",
    "serving_check": "/Users/zacharywright/Documents/GitHub/hermes_dev/hermes-flight-recorder/experiments/qwen3_4b_flightrecorder/serving/local_adapter_mock_suite/trace_only/serving_check.json",
    "serving_profile": "/Users/zacharywright/Documents/GitHub/hermes_dev/hermes-flight-recorder/experiments/qwen3_4b_flightrecorder/serving/local_adapter_mock_suite/trace_only/serving_profile.json"
  },
  "schema_version": "hfr.serving_lifecycle_run.v1",
  "server": {
    "command": [
      "/Users/zacharywright/Documents/GitHub/hermes_dev/hermes-flight-recorder/.venv/bin/python3",
      "scripts/mock_openai_serving.py",
      "--port",
      "63666",
      "--model",
      "Qwen/Qwen3-4B-Instruct-2507",
      "--adapter",
      "experiments/qwen3_4b_flightrecorder/adapters/qwen3_4b_local_trace_sft/trace_sft_adapter"
    ],
    "command_text": "/Users/zacharywright/Documents/GitHub/hermes_dev/hermes-flight-recorder/.venv/bin/python3 scripts/mock_openai_serving.py --port 63666 --model Qwen/Qwen3-4B-Instruct-2507 --adapter experiments/qwen3_4b_flightrecorder/adapters/qwen3_4b_local_trace_sft/trace_sft_adapter",
    "cwd": "/Users/zacharywright/Documents/GitHub/hermes_dev/hermes-flight-recorder",
    "exit_code_after_cleanup": -15,
    "pid": 40578,
    "stderr": "/Users/zacharywright/Documents/GitHub/hermes_dev/hermes-flight-recorder/experiments/qwen3_4b_flightrecorder/serving/local_adapter_mock_suite/trace_only/server_stderr.txt",
    "stdout": "/Users/zacharywright/Documents/GitHub/hermes_dev/hermes-flight-recorder/experiments/qwen3_4b_flightrecorder/serving/local_adapter_mock_suite/trace_only/server_stdout.txt"
  },
  "started_at": "2026-07-02T14:14:03Z"
}
